{
  "schema_version": "0.9.0",
  "method": "laplace",
  "method_family": "asymptotic",
  "approximation": "quadratic",
  "parameter_names": [
    "log10_k_ads",
    "log10_k_des",
    "log10_k_rxn"
  ],
  "parameter_units": [
    "log10(1/s)",
    "log10(1/s)",
    "log10(1/s)"
  ],
  "parameter_transform": "log10",
  "parameter_roles": [
    "interest",
    "interest",
    "interest"
  ],
  "n_samples": 400,
  "point_estimate": [
    -3.2,
    -1.7,
    0.4
  ],
  "samples": {
    "sha256": "c75cd958fe4531e7af140d71b4435776a548e2a9053407fb9dd01e3bfce9be7e",
    "size_bytes": 11636,
    "format": "csv",
    "path": "examples/data/ensemble-samples-prbs-co-ox.csv",
    "media_type": "text/csv",
    "rows": 400
  },
  "conditioning": {
    "kind": "conditional",
    "held_fixed": [
      "ms_sensitivity_factors",
      "fragmentation_matrix",
      "feed_composition"
    ],
    "prior_source": "none -- Type A only (JCGM 100:2008); the held_fixed list names what a marginalized re-evaluation would have to widen over"
  },
  "nuisance_budget": [
    {
      "parameter": "log10_k_ads",
      "nuisance": "ms_sensitivity_m28",
      "sensitivity": -0.42,
      "sigma_nuisance": null,
      "source": "no record states an MS sensitivity uncertainty; the prior-free envelope is the reported answer, not an invented sigma"
    },
    {
      "parameter": "log10_k_rxn",
      "nuisance": "fragmentation_co2_to_co",
      "sensitivity": 11.0,
      "sigma_nuisance": 0.003,
      "contribution_decades": 0.033,
      "source": "spread of the declared vs applied coefficient preserved under declared_unused"
    }
  ],
  "notes": "SYNTHETIC, for the schema's worked example. point_estimate is the optimum of the synthetic fit; the samples are a seeded Laplace draw."
}
